<?xml version="1.0" encoding="utf-8"?>
<users xmlns:xsi="http://www.w3.org/2001/XMLSchema-instance" xsi:noNamespaceSchemaLocation="users.xsd">
  <user category="staff">
    <!--id should be auto-generated by the system-->
    <userid>1</userid>
    <username>admin</username>
    <name>
      <fname>Staff</fname>
      <lname>Smith</lname>
    </name>
    <email>staffsmith@test.ca</email>
    <!--make sure password is encrypted-->
    <pswd>admin@test123</pswd>
  </user>
  <user category="client">
    <userid>2</userid>
    <username>client</username>
    <name>
      <fname>Client</fname>
      <lname>Smith</lname>
    </name>
    <email>clientsmith@gmail.ca</email>
    <!--make sure password is encrypted-->
    <pswd>client@test123</pswd>
  </user>
  <user category="client">
    <userid>68</userid>
    <username>missvickie</username>
    <name>
      <fname>Vicky</fname>
      <lname>Chips</lname>
    </name>
    <email>mvickie@gmail.ca</email>
    <!--make sure password is encrypted-->
    <pswd>ccc</pswd>
  </user>
</users>